{
  "schema_version": "1.0",
  "mission": {
    "name": "site-audit",
    "mode": "lite",
    "timestamp": "2026-05-10T00:00:00Z",
    "run_directory": "runs/2026-05-10-freecalchub-com-site-audit-lite/",
    "agents_invoked": ["coordinator-direct"]
  },
  "site": {
    "domain": "freecalchub.com",
    "scope": "Whole domain (8 pages sampled from 130 in sitemap.xml)",
    "pages_assessed": 8
  },
  "scorecards": {
    "ai_search_readiness": {
      "total": 39,
      "llms_txt": {
        "score": 9,
        "status": "present, comprehensive (134 pages, 9 clusters, ~34928 words, generated 2026-02-14)",
        "notes": "Genuine asset. Minor concern: content within may be staler than the file's lastmod."
      },
      "structured_data_coverage": {
        "score": 9,
        "status": "100% of sampled pages",
        "notes": "SoftwareApplication, FAQPage, Organization, WebSite, AggregateRating present. Rating values look manually set — flag for verifiability per Constitution rule 5."
      },
      "answerability": {
        "score": 8,
        "status": "strong",
        "notes": "FAQ schema everywhere; clear definitional content. Could push higher with TL;DR summary blocks at top of each calculator."
      },
      "sitemap_freshness": {
        "score": 6,
        "status": "sitemap itself recent (2025-11-30); most URLs clustered at 2025-10-24",
        "notes": "Recrawl signal weak. Either pages truly haven't changed or lastmod is stale."
      },
      "ai_crawler_policy": {
        "score": 7,
        "status": "allow (implicit via User-agent: *)",
        "notes": "GPTBot, Claude-User, PerplexityBot etc. allowed by default but not explicitly named. Fix #6 makes this explicit."
      }
    },
    "traditional_seo": {
      "total": 36,
      "core_web_vitals": {
        "score": 5,
        "status": "not measured (no Lighthouse access)",
        "notes": "Conservative placeholder. Page construction (deferred JS, ~6-8 stylesheets, no synchronous chart.js on most pages) suggests likely 7/10 if measured. Run Lighthouse before acting."
      },
      "crawlability": {
        "score": 7,
        "status": "mostly clean",
        "notes": "Sitemap present and structured; robots.txt clean. Penalised for canonical inconsistency (Fix #2) and Coming Soon stubs in sitemap (Fix #5)."
      },
      "on_page": {
        "score": 6,
        "status": "~80% complete across sampled set",
        "notes": "Mortgage calculator missing canonical+description+OG. Affordability has truncated meta description. BMI canonical relative."
      },
      "internal_linking": {
        "score": 6,
        "status": "not deeply assessed (lite scope)",
        "notes": "Schema relatedLink arrays show intent. Category hub structure sensible. Actual <a> link graph not crawled."
      },
      "authority": {
        "score": 5,
        "status": "not measured (no Ahrefs/Moz)",
        "notes": "Conservative placeholder. AggregateRating values in schema look manually placed — flagged in Fix #8."
      }
    }
  },
  "fixes": [
    {
      "id": "fch-001",
      "title": "Add canonical + meta description + OG tags to mortgage-calculator/index.html",
      "category": "technical",
      "impact": 8,
      "effort": 1,
      "roi": 8.0,
      "estimated_traffic_lift": {
        "value": 350,
        "unit": "sessions_per_month",
        "confidence": "low"
      },
      "min_diff": true,
      "owner_agent": "@seo-technical",
      "evidence_path": "finance/mortgage/mortgage-calculator/index.html (lines 11-30 missing canonical, description, og:*)"
    },
    {
      "id": "fch-002",
      "title": "Standardise all canonicals to absolute https://www.freecalchub.com/ across site",
      "category": "technical",
      "impact": 9,
      "effort": 3,
      "roi": 3.0,
      "estimated_traffic_lift": {
        "value": 8,
        "unit": "keywords_top10",
        "confidence": "medium"
      },
      "min_diff": true,
      "owner_agent": "@seo-technical",
      "evidence_path": "Sampled pages show 4 patterns: www absolute, non-www absolute, relative, missing"
    },
    {
      "id": "fch-003",
      "title": "Fix BMI calculator canonical from relative path to absolute www URL",
      "category": "technical",
      "impact": 6,
      "effort": 1,
      "roi": 6.0,
      "estimated_traffic_lift": {
        "value": 2,
        "unit": "keywords_top10",
        "confidence": "low"
      },
      "min_diff": true,
      "owner_agent": "@seo-technical",
      "evidence_path": "health/bmi/bmi-calculator/index.html line 15"
    },
    {
      "id": "fch-004",
      "title": "Complete the truncated meta description on affordability-calculator (currently ends with ellipsis)",
      "category": "content",
      "impact": 5,
      "effort": 1,
      "roi": 5.0,
      "estimated_traffic_lift": {
        "value": 7,
        "unit": "percent",
        "confidence": "medium"
      },
      "min_diff": true,
      "owner_agent": "@seo-content",
      "evidence_path": "finance/mortgage/affordability-calculator/index.html line 13"
    },
    {
      "id": "fch-005",
      "title": "Noindex or replace Coming Soon stub pages (monthly-budget, expense-tracker, debt-to-income)",
      "category": "content",
      "impact": 6,
      "effort": 2,
      "roi": 3.0,
      "estimated_traffic_lift": {
        "value": 50,
        "unit": "sessions_per_month",
        "confidence": "low"
      },
      "min_diff": true,
      "owner_agent": "@seo-content",
      "evidence_path": "finance/budgeting/{monthly-budget,expense-tracker,debt-to-income-ratio}-calculator/index.html"
    },
    {
      "id": "fch-006",
      "title": "Add explicit User-agent allow blocks for GPTBot, Claude-User, PerplexityBot, Google-Extended in robots.txt",
      "category": "ai-search",
      "impact": 4,
      "effort": 1,
      "roi": 4.0,
      "estimated_traffic_lift": {
        "value": 0,
        "unit": "sessions_per_month",
        "confidence": "low"
      },
      "min_diff": true,
      "owner_agent": "@seo-technical",
      "evidence_path": "robots.txt — currently no AI crawler blocks named"
    },
    {
      "id": "fch-007",
      "title": "Refresh sitemap lastmod dates for content actually updated since 2025-10-24",
      "category": "technical",
      "impact": 4,
      "effort": 2,
      "roi": 2.0,
      "estimated_traffic_lift": {
        "value": 0,
        "unit": "sessions_per_month",
        "confidence": "low"
      },
      "min_diff": true,
      "owner_agent": "@seo-technical",
      "evidence_path": "sitemap.xml — 100+ URLs at lastmod 2025-10-24"
    },
    {
      "id": "fch-008",
      "title": "Verify or soften the '10,000+ users' and 'CFPB-compliant' claims in Organization schema",
      "category": "authority",
      "impact": 3,
      "effort": 1,
      "roi": 3.0,
      "estimated_traffic_lift": {
        "value": 0,
        "unit": "sessions_per_month",
        "confidence": "low"
      },
      "min_diff": true,
      "owner_agent": "@seo-strategist",
      "evidence_path": "index.html line 31 — Organization schema description"
    }
  ],
  "prior_findings_referenced": [],
  "next_suggested_mission": "technical-fix"
}
